id;name;description;price;catalog_url;category_id;picture_url
581;Виброплита CHAMPION TR72;Уровень шума (дБ): 102, Тип запуска: ручной, Мощность (кВт): 4.8, Мощность (л.с.): 6.5, Объем двигателя (см3): 196, Тип двигателя: бензиновый, Производительность (м2/ч): 120, Глубина уплотнения (мм): 250, Частота вибрации (уд/мин): 650, Амплитуда удара (мм): 65, Сила удара (кН): 10, Виброплита: прямоходная;51700;…;118;http://magazilla.ru/jpg_zoom1/1255558.jpg
582;Виброплита Grost TR-70E1;Мощность (кВт): 2.2, Напряжение сети: 220 В, Тип двигателя: электрический, Скорость перемещения (м/мин): 10.5, Глубина уплотнения (мм): 250, Частота вибрации (уд/мин): 570, Амплитуда удара (мм): 65, Сила удара (кН): 12, Тип: вибронога;45441;…;118;http://magazilla.ru/jpg_zoom1/787264.jpg
583;Виброплита Belle PCX 13/40;Уровень шума (дБ): 105, Тип запуска: ручной, Мощность (кВт): 2.9, Мощность (л.с.): 4, Объем двигателя (см3): 118, Тип двигателя: бензиновый, Скорость перемещения (м/мин): 20, Частота вибрации (уд/мин): 6060, Сила удара (кН): 13, Виброплита: прямоходная, Тип: виброплита;78184;…;118;http://magazilla.ru/jpg_zoom1/825847.jpg
584;Виброплита Sturm PC8806H;Уровень шума (дБ): 98, Колеса, Оросительная система, Тип запуска: ручной, Мощность (кВт): 3, Мощность (л.с.): 5.5, Объем двигателя (см3): 163, Тип двигателя: бензиновый, Скорость перемещения (м/мин): 14.7, Глубина уплотнения (мм): 200, Частота вибрации (уд/мин): 4500, Сила удара (кН): 12.1, Виброплита: прямоходная;41497;…;118;http://magazilla.ru/jpg_zoom1/797665.jpg
585;Виброплита TSS MSD1.2;Уровень шума (дБ): 105, Тип запуска: ручной, Мощность (кВт): 0.9, Мощность (л.с.): 1.2, Объем двигателя (см3): 35, Тип двигателя: бензиновый, Макс. длина рейки (м): 4.3, Частота вибрации (уд/мин): 8500, Тип: виброрейка;23860;…;118;http://magazilla.ru/jpg_zoom1/873494.jpg
586;Плиткорез Prorab 5924;Угловая резка, Водяное охлаждение диска, Глубина реза (мм): 60, Длина реза (мм): 920, Диаметр диска (мм): 250, Кол-во оборотов: 3000, Мощность (Вт): 1100, Тип: электрический стационарный;26478;…;119;http://magazilla.ru/jpg_zoom1/678654.jpg
587;Плиткорез RemoColor 46-0-650;Длина реза (мм): 500, Тип: ручной;4536;…;119;http://magazilla.ru/jpg_zoom1/1230846.jpg
588;Плиткорез Makita 4101RH;Угловая резка, Водяное охлаждение диска, Глубина реза (мм): 42, Диаметр диска (мм): 125, Кол-во оборотов: 12000, Мощность (Вт): 860, Тип: электрический переносной;24748;…;119;http://magazilla.ru/jpg_zoom1/1166316.jpg
589;Плиткорез Zubr 33195-50;Длина реза (мм): 500, Тип: ручной;2645;…;119;http://magazilla.ru/jpg_zoom1/686693.jpg
590;Плиткорез Zubr 33193-70-Z01;Длина реза (мм): 700, Тип: ручной;5020;…;119;http://magazilla.ru/jpg_zoom1/686690.jpg
591;Мотобур Diold MR-1-52;Макс. диаметр (см): 30, Мощность (кВт): 1.5, Объем двигателя (см3): 51.7, Передаточное число редуктора: 30, Кол-во операторов: 1, Привод: механический, Тип: мотобур;10015;…;120;http://magazilla.ru/jpg_zoom1/1086172.jpg
592;Мотобур Iron Mole M 15-450;Макс. диаметр (см): 45, Максимальные обороты (об/мин): 3600, Мощность (кВт): 11, Объем двигателя (см3): 420, Производительность (л/мин): 20, Макс. давление в гидросистеме (бар): 220, Объем гидросистемы (л): 22, Реверс, Кол-во операторов: 1, Привод: гидравлический, Тип: мотобур;183150;…;120;http://magazilla.ru/jpg_zoom1/876959.jpg
593;Мотобур Forward FEA-52/2600-2;Бур в комплекте, Макс. диаметр (см): 20, Максимальные обороты (об/мин): 9000, Мощность (кВт): 2.4, Объем двигателя (см3): 52, Передаточное число редуктора: 40, Кол-во операторов: 2, Привод: механический, Тип: мотобур;6479;…;120;http://magazilla.ru/jpg/751997.jpg
594;Мотобур Elmos EPB-13;Макс. диаметр (см): 30, Мощность (кВт): 2.2, Объем двигателя (см3): 48.6, Передаточное число редуктора: 40, Кол-во операторов: 1, Привод: механический, Тип: мотобур;24816;…;120;http://magazilla.ru/jpg_zoom1/751885.jpg
595;Мотобур Elmos EPB-11;Макс. диаметр (см): 20, Максимальные обороты (об/мин): 8000, Мощность (кВт): 1.47, Объем двигателя (см3): 40.6, Передаточное число редуктора: 40, Кол-во операторов: 1, Привод: механический, Тип: мотобур;21780;…;120;http://magazilla.ru/jpg/751856.jpg
596;Строительный фен Black&Decker KX2001K;Вес (г): 850, скребок, кейс, Комплектация: насадок: 4 насадки на сопло, Макс. температура (°C): 600, Мин. температура (°C): 50, Плавная регулировка, Скоростей вентилятора (шт): 2, Макс. производительность (л/мин): 500, Потребляемая мощность (Вт): 2000, Тип: пистолетный;1710;…;121;http://magazilla.ru/jpg_zoom1/602616.jpg
597;Краскопульт Wagner ProjectPro 117;Выносной компрессор, Распыление: безвоздушное, Расход покрасочного материала (л/мин): 0.95, Номинальное давление (бар): 200, Потребляемая мощность (Вт): 670, Вид: краскопульт, Тип: электрический;8789;…;122;http://magazilla.ru/jpg_zoom1/680599.jpg
598;Краскопульт Bosch PFS 2000;Выносной компрессор, Объем (мл): 800, Резервуар, Распыление: пневматическое, Расход покрасочного материала (л/мин): 0.2, Потребляемая мощность (Вт): 440, Вид: краскопульт, Тип: электрический ;4889;…;122;http://magazilla.ru/jpg_zoom1/654001.jpg
599;Краскопульт Bosch PFS 3000-2;Выносной компрессор, Объем (мл): 1000, Резервуар, Распыление: пневматическое, Расход покрасочного материала (л/мин): 0.3, Потребляемая мощность (Вт): 650, Вид: краскопульт, Тип: электрический;6988;…;122;http://magazilla.ru/jpg_zoom1/652202.jpg
600;Краскопульт Wagner W 400;Объем (мл): 1300, Резервуар, Распыление: пневматическое, Расход покрасочного материала (л/мин): 0.23, Потребляемая мощность (Вт): 460, Вид: краскопульт, Тип: электрический;7425;…;122;http://magazilla.ru/jpg_zoom1/1308945.jpg
601;Краскопульт Stavr KE-800;Выносной компрессор, Объем (мл): 800, Резервуар, Система распыления: HVLP (High Volume Low Pressure), Распыление: пневматическое, Расход покрасочного материала (л/мин): 0.4, Потребляемая мощность (Вт): 800, Вид: краскопульт, Тип: электрический;2695;…;122;http://magazilla.ru/jpg_zoom1/956623.jpg
602;Штроборез Kalibr Master ShTBE-2600/230M;Вес (кг): 10.5, Длина сетевого шнура (м): 2, плавный пуск, Глубина обработки (мм): 20 – 65, Ширина обработки (мм): 9 – 40, Кол-во оборотов (об/мин): 4800, Диаметр посадочного отверстия (мм): 22.2, Диаметр диска/фрезы (мм): 230, Потребляемая мощность (кВт): 2.6, Рабочих дисков/фрез (шт): 2, Рабочий элемент: диск;8193;…;123;http://magazilla.ru/jpg_zoom1/1186359.jpg
603;Штроборез Hammer STR115;Вес (кг): 10, Кейс в комплекте, лазерный маркер, электронная защита двигателя, плавный пуск, Глубина обработки (мм): 15 – 35, Ширина обработки (мм): 3 – 40, Кол-во оборотов (об/мин): 10000, Диаметр посадочного отверстия (мм): 20, Диаметр диска/фрезы (мм): 115, Потребляемая мощность (кВт): 2.5, Рабочих дисков/фрез (шт): 8;16498;…;123;http://magazilla.ru/jpg_zoom1/1184123.jpg
604;Штроборез Prorab 9825 K;Кейс в комплекте, электронная защита двигателя, поддержание оборотов, плавный пуск, Глубина обработки (мм): 8 – 27, Ширина обработки (мм): 8 – 26, Кол-во оборотов (об/мин): 9000, Диаметр посадочного отверстия (мм): 22.2, Диаметр диска/фрезы (мм): 125, Потребляемая мощность (кВт): 1.6, Рабочих дисков/фрез (шт): 2;6799;…;123;http://magazilla.ru/jpg_zoom1/1187155.jpg
605;Штроборез Makita 4112HS;Вес (кг): 11.4, Габариты (мм): 648x240x273, Уровень шума (дБ): 114, Длина сетевого шнура (м): 2, Кейс в комплекте, предохранительная муфта, плавный пуск, Глубина обработки (мм): 100, Кол-во оборотов (об/мин): 5000, Диаметр посадочного отверстия (мм): 25.4, Диаметр диска/фрезы (мм): 305, Потребляемая мощность (кВт): 2.4;32899;…;123;http://magazilla.ru/jpg_zoom1/1184732.jpg
606;Штроборез Metabo MFE 30;Вес (кг): 4.3, Уровень шума (дБ): 103, Длина сетевого шнура (м): 4, Кейс в комплекте, предохранительная муфта, электронная защита двигателя, поддержание оборотов, плавный пуск, Глубина обработки (мм): 30, Ширина обработки (мм): 10 – 30, Кол-во оборотов (об/мин): 8200, Диаметр посадочного отверстия (мм): 22.2;26627;…;123;http://magazilla.ru/jpg_zoom1/1185165.jpg
607;Клеевой пистолет Metabo KE 3000;Опорная подставка, Тип батареи: Li-Ion, Функции: Источник питания: сеть, Время нагрева (мин): 6, Скорость подачи клея (г/мин): 18, Длина стержня (мм): 200, Диаметр стержня (мм): 11, Макс. потребляемая мощность: 200, Конструкция: Т-образный;1819;…;124;http://magazilla.ru/jpg_zoom1/668837.jpg
608;Клеевой пистолет Hammer GN-07;Опорная подставка, Тип батареи: Li-Ion, Функции: Источник питания: сеть, Скорость подачи клея (г/мин): 8, Длина стержня (мм): 100, Диаметр стержня (мм): 7.2, Макс. потребляемая мощность: 60, Конструкция: Т-образный;323;…;124;http://magazilla.ru/jpg_zoom1/1279020.jpg
609;Клеевой пистолет Elitech PKL 5015K;Опорная подставка, Тип батареи: Li-Ion, Функции: Источник питания: сеть, Скорость подачи клея (г/мин): 15, Длина стержня (мм): 100, Диаметр стержня (мм): 11.2, Макс. потребляемая мощность: 500, Конструкция: Т-образный;1193;…;124;http://magazilla.ru/jpg_zoom1/1295555.jpg
610;Клеевой пистолет RedVerg RD-GG80;Опорная подставка, Тип батареи: Li-Ion, Функции: Источник питания: сеть, Время нагрева (мин): 3, Скорость подачи клея (г/мин): 16, Диаметр стержня (мм): 11.2, Макс. потребляемая мощность: 80, Конструкция: Т-образный;385;…;124;http://magazilla.ru/jpg_zoom1/1280094.jpg
611;Клеевой пистолет Bosch GKP 200 CE Professional;Кейс, Опорная подставка, Сменные сопла, Тип батареи: Li-Ion, Источник питания: сеть, Функции: Индикатор подключения к сети, Время нагрева (мин): 4, Скорость подачи клея (г/мин): 30, Длина стержня (мм): 200, Диаметр стержня (мм): 11, Макс. потребляемая мощность: 500, Конструкция: Т-образный;7535;…;124;http://magazilla.ru/jpg_zoom1/667306.jpg
612;Ящик для инструмента Metabo MetaLoc IV;габариты (мм): 396x296x315, Материал замков: металл, Материал: пластик, Утапливаемая ручка, Назначение: для ручного инструмента, Тип: ящик;3071;…;125;http://magazilla.ru/jpg_zoom1/590538.jpg
613;Ящик для инструмента KRAFTOOL 38714-24;"Материал: ткань, Кол-во отделений/карманов: 25, Размер: 24"", Назначение: для ручного инструмента, Тип: сумка";1450;…;125;http://magazilla.ru/jpg/592104.jpg
614;Ящик для инструмента Metabo ToolBag Small;габариты (мм): 460x260x280, Материал: ткань, Назначение: для ручного инструмента, Тип: сумка;1428;…;125;http://magazilla.ru/jpg_zoom1/590655.jpg
615;Ящик для инструмента Stanley 1-95-611;Вес (кг): 2.21, габариты (мм): 360x460x270, Материал: ткань, Кол-во отделений/карманов: 50, Назначение: для ручного инструмента, Тип: рюкзак;5137;…;125;http://magazilla.ru/jpg_zoom1/915557.jpg
616;Ящик для инструмента Stanley 1-92-908;"габариты (мм): 562x314x300, Материал замков: металл, Материал: пластик, Утапливаемая ручка, Съемный лоток, Размер: 22"", Назначение: для ручного инструмента, Тип: ящик";2150;…;125;http://magazilla.ru/jpg_zoom1/785792.jpg
617;Набор инструментов WORKPRO W009021;Вес (кг): 2.2, Хранение инструмента: чехол/сумка, Рулетка (шт): 1, Плоскогубцы (шт): 2, Молоток (шт): 1, Отвертка (шт): 4, Разводной ключ (шт): 1, Биты (шт): 19, Отверточная рукоятка (шт): 1, Размеры торцевых головок (6 граней) (мм): 5;2318;…;126;http://magazilla.ru/jpg_zoom1/1221353.jpg
618;Набор инструментов Gembird TK-ELEC;"Хранение инструмента: чехол/сумка, Пинцет (шт): 1, Плоскогубцы (шт): 1, Отвертка (шт): 6, Разводной ключ (шт): 1, Биты (шт): 22, Отверточная рукоятка (шт): 1, Размеры торцевых головок (6 граней) (мм): 5 — 11, Торцевые головки (6 граней) (шт): 7, Посадочный квадрат (""): 1/4, Общее кол-во единиц (шт): 63";3493;…;126;http://magazilla.ru/jpg_zoom1/662024.jpg
619;Набор инструментов JONNESWAY S04H3120S;"Хранение инструмента: металлический кейс, Свечные головки (шт): 1, Ключ-трещотка (шт): 1, Размеры торцевых головок (6 граней) (мм): 6 — 23, Торцевые головки (6 граней) (шт): 13, Посадочный квадрат (""): 3/8, Общее кол-во единиц (шт): 20";3936;…;126;http://magazilla.ru/jpg_zoom1/523035.jpg
620;Набор инструментов Kolner KTS 39;"Хранение инструмента: пластиковый кейс, Рулетка (шт): 1, Молоток (шт): 1, Отвертка (шт): 4, Биты (шт): 20, Отверточная рукоятка (шт): 1, Шестигранных ключей (шт): 8, Посадочный квадрат (""): 3/8, Общее кол-во единиц (шт): 39";940;…;126;http://magazilla.ru/jpg_zoom1/1186066.jpg
621;Набор инструментов TOPTUL GZC14010;Хранение инструмента: пластиковый кейс, Отвертка (шт): 14, Общее кол-во единиц (шт): 14;2489;…;126;http://magazilla.ru/jpg_zoom1/1050571.jpg
622;Бита HANS TT-2G;"Хранение инструмента: ложемент, Длина бит / торцевых головок: стандартные и удлиненные, Размеры торцевых головок (6 граней) (мм): 8 — 32, Торцевые головки (6 граней) (шт): 32, Посадочный квадрат: 1/2"", Общее кол-во единиц (шт): 32";5709;…;127;http://magazilla.ru/jpg_zoom1/1232909.jpg
623;Бита HANS 84610M;"Хранение инструмента: металлический кейс, Длина бит / торцевых головок: удлиненные, Размеры торцевых головок (6 граней) (мм): 10 — 24, Торцевые головки (6 граней) (шт): 10, Посадочный квадрат: 1/2"", Общее кол-во единиц (шт): 10";3069;…;127;http://magazilla.ru/jpg_zoom1/1235740.jpg
624;Бита HANS 46410;Хранение инструмента: рельс, Длина бит / торцевых головок: стандартные, Размеры торцевых головок (Е-профиль): E10;1529;…;127;http://magazilla.ru/jpg_zoom1/1237206.jpg
625;Бита HANS 46026-49;Хранение инструмента: пластиковый кейс, Длина бит / торцевых головок: удлиненные, Размеры бит Hex: H4;3025;…;127;http://magazilla.ru/jpg_zoom1/1246869.jpg
626;Ножовка Bahco 302;Вес (г): 370, Материал рукоятки: дерево, Глубина рамы (мм): 300, Заточка зубьев: стандартная, Длина полотна (мм): 130, Назначение: по дереву, Тип: лобзиковая;166;…;128;http://magazilla.ru/jpg_zoom1/901858.jpg
627;Ножовка Fiskars 123880;Материал рукоятки: пластик/резина, Хранение полотна внутри рамы, Заточка зубьев: стандартная, Длина полотна (мм): 255, Назначение: по дереву, Тип: садовая;2264;…;128;http://magazilla.ru/jpg_zoom1/817944.jpg
628;Ножовка Bahco 396-LAP;Вес (г): 200, Материал рукоятки: пластик/резина, Хранение полотна внутри рамы, Покрытие полотна: для уменьшения трения, Заточка зубьев: стандартная, Закаленные зубья, Длина полотна (мм): 190, Назначение: по дереву, Тип: мини-пила;1868;…;128;http://magazilla.ru/jpg_zoom1/901722.jpg
629;Ножовка KRAFTOOL 1-15194-18-22;Материал рукоятки: пластик, Заточка зубьев: трехгранная, Закаленные зубья, Длина полотна (мм): 185, Назначение: многоцелевая, Тип: японская;579;…;128;http://magazilla.ru/jpg_zoom1/961066.jpg
630;Ножовка Bahco PC-24-TIM;Вес (г): 540, Материал рукоятки: пластик/резина, Заточка зубьев: стандартная, Длина полотна (мм): 600, Назначение: по дереву, Тип: стандартная;1835;…;128;http://magazilla.ru/jpg_zoom1/659547.jpg
631;Топор VIRA 900103;Вес топора (г): 1000, Прорезиненная рукоятка, Материал рукоятки: стекловолокно, Тип: универсальный;922;…;129;http://magazilla.ru/jpg_zoom1/990845.jpg
632;Топор VIRA 900102;Вес топора (г): 800, Общая длина (мм): 380, Прорезиненная рукоятка, Материал рукоятки: стекловолокно, Тип: универсальный;713;…;129;http://magazilla.ru/jpg_zoom1/990844.jpg
633;Топор NAREX 8908;Вес топора (г): 1070, Общая длина (мм): 400, Защита лезвия от коррозии, Материал рукоятки: дерево, Тип: универсальный;2830;…;129;http://magazilla.ru/jpg_zoom1/1140247.jpg
634;Топор 888 8502229;Вес топора (г): 1400, Материал рукоятки: дерево, Тип: универсальный;687;…;129;http://magazilla.ru/jpg_zoom1/938248.jpg
635;Топор 888 8502209;Вес топора (г): 900, Материал рукоятки: дерево, Тип: универсальный;529;…;129;http://magazilla.ru/jpg_zoom1/938234.jpg
636;Тиски Stanley 1-83-069;Вес (кг): 1.6, Материал корпуса: сталь, сменные губки, шарнирный механизм, Усилие зажима (кН): 0.25, Глубина зажима (мм): 40, Ширина зажима (мм): 70, Механизм сжатия: винтовой, Назначение тисков: слесарные, Тип: тиски;2030;…;130;http://magazilla.ru/jpg_zoom1/1115028.jpg
637;Тиски Dexx 32470-150;Вес (кг): 10.4, Материал корпуса: чугун, сменные губки, наковальня, поворотное основание, Ширина губок (мм): 150, Ширина зажима (мм): 170, Механизм сжатия: винтовой, Назначение тисков: слесарные, Тип: тиски;2634;…;130;http://magazilla.ru/jpg_zoom1/1132789.jpg
638;Тиски STAYER 3247-70;Вес (кг): 1.11, Материал корпуса: чугун, поворотное основание, Ширина губок (мм): 70, Ширина зажима (мм): 40, Механизм сжатия: винтовой, Назначение тисков: слесарные, Тип: тиски;459;…;130;http://magazilla.ru/jpg_zoom1/1190497.jpg
639;Тиски Dexx 3205-80-300;Вес (кг): 0.53, Материал корпуса: сталь, сменные губки, Глубина зажима (мм): 80, Ширина зажима (мм): 300, Механизм сжатия: винтовой, Конструкция: F-образная, Тип: струбцина;146;…;130;http://magazilla.ru/jpg_zoom1/1132799.jpg
640;Тиски Zubr 3258;Вес (кг): 16, Материал корпуса: чугун, сменные губки, наковальня, поворотное основание, Ширина губок (мм): 150, Ширина зажима (мм): 150, Механизм сжатия: винтовой, Назначение тисков: слесарные, Тип: тиски;5013;…;130;http://magazilla.ru/jpg_zoom1/1139886.jpg
641;Ножницы по металлу Stanley 2-14-567;Длина (мм): 250, Прорезиненные рукоятки, Блокировка лезвий, Возвратная пружина, Сквозной рез, Марка стали: Cr-Mo, Толщина реза (мм): 1.2, Рез: левый, Тип: по листовому металлу;757;…;131;http://magazilla.ru/jpg_zoom1/1187712.jpg
