id;name;description;price;catalog_url;category_id;picture_url
790;Электродуховка Scarlett SC-EO93O18;Габариты (см): 33x53x39, Покрытие камеры: нержавеющая сталь, Открытие дверцы: откидная, автоотключение, таймер, конвекция, Функции и возможности: гриль, Максимальная температура (°C): 250, Управление: переключатели, Мощность (Вт): 1600, Объем (л): 35;4928;…;161;http://magazilla.ru/jpg_zoom1/1237814.jpg
791;Электродуховка Saturn ST-EC1077;Габариты (см): 34x61x43, Покрытие камеры: нержавеющая сталь, Открытие дверцы: откидная, автоотключение, таймер, Функции и возможности: гриль, Максимальная температура (°C): 320, Управление: переключатели, Мощность (Вт): 1200, Объем (л): 45 ;4107;…;161;http://magazilla.ru/jpg_zoom1/121140.jpg
792;Электродуховка Simfer M3626;Габариты (см): 33x52x44, Покрытие камеры: нержавеющая сталь, Открытие дверцы: откидная, Освещение, автоотключение, таймер, размораживание, конвекция, Функции и возможности: гриль, Максимальная температура (°C): 250, Управление: переключатели, Мощность (Вт): 1300, Объем (л): 36;7781;…;161;http://magazilla.ru/jpg_zoom1/624831.jpg
793;Миксер Gastrorag B-012;Материал чаши блендера: пластик, Питание: сеть, Предустановленные программы: Насадки: блендер, Импульсный режим, Бесступенчатый регулятор скорости, Мощность (Вт): 1390, Емкость чаши (л): 2, Тип устройства: блендер ;6369;…;162;http://magazilla.ru/jpg_zoom1/948142.jpg
794;Миксер Gemlux GL-PB-379;Материал чаши блендера: пластик, Питание: сеть, Насадки: блендер, колка льда, Предустановленные программы: смузи, Импульсный режим, Бесступенчатый регулятор скорости, Мощность (Вт): 2000, Емкость чаши (л): 2, Тип устройства: блендер;7632;…;162;http://mzimg.com/big/41/f8wgda2pa41.jpg
795;Миксер Redmond RKA-FP4;Питание: сеть, Предустановленные программы: Насадки: доп. насадки: для терки;3837;…;162;http://magazilla.ru/jpg_zoom1/614432.jpg
796;Миксер Zelmer 481.5;В первую очередь этот миксер выделяется дизайном: на рынке можно найти модели белого цвета с яркими зелёными вставками;1531;…;162;http://magazilla.ru/jpg_zoom1/86623.jpg
797;Миксер Vitek VT-1417;Питание: сеть, крюки для замеса, Предустановленные программы: Насадки: венчики для взбивания, Турборежим, Кол-во скоростей: 5, Мощность (Вт): 700, Поворотная чаша, Тип устройства: стационарный миксер;3226;…;162;http://magazilla.ru/jpg_zoom1/1092366.jpg
798;Электрочайник Tefal KI 730;Материал: стекло, Индикатор уровня воды, Покрытие нагревателя: нержавеющая сталь, Нагревательный элемент: скрытый, Потребляемая мощность (Вт): 2400, Объем (л): 1.7, Тип: электрочайник;2739;…;163;http://magazilla.ru/jpg_zoom1/1189669.jpg
799;Электрочайник Irit IR-1321;Материал: сталь, Покрытие нагревателя: нержавеющая сталь, Нагревательный элемент: скрытый, Потребляемая мощность (Вт): 1500, Объем (л): 1.8, Тип: электрочайник ;369;…;163;http://magazilla.ru/jpg/355790.jpg
800;Электрочайник Oursson EK1760M;Материал: сталь, Индикатор уровня воды, Покрытие нагревателя: нержавеющая сталь, Нагревательный элемент: скрытый, Потребляемая мощность (Вт): 2400, Объем (л): 1.7, Тип: электрочайник ;2825;…;163;http://magazilla.ru/jpg_zoom1/518701.jpg
801;Электрочайник Atlanta ATH 2431;Материал: сталь, Покрытие нагревателя: нержавеющая сталь, Нагревательный элемент: скрытый, Потребляемая мощность (Вт): 1500, Объем (л): 1.8, Тип: электрочайник;647;…;163;http://magazilla.ru/jpg_zoom1/802894.jpg
802;Электрочайник Atlanta ATH 2420;Материал: сталь, Индикатор уровня воды, Покрытие нагревателя: нержавеющая сталь, Нагревательный элемент: скрытый, Потребляемая мощность (Вт): 1800, Объем (л): 1.2, Тип: электрочайник;1016;…;163;http://magazilla.ru/jpg/392153.jpg
803;Мультиварка Atlanta ATH-1561;Антипригарное покрытие: тефлоновое, таймер автоотключения, Функции: автоприготовление, выпечка, тушение, рис/гречка, каша/суп, Программы: приготовление на пару, Кол-во программ: 6, Мощность (Вт): 700, Объем (л): 4, Тип: мультиварка;2194;…;164;http://magazilla.ru/jpg_zoom1/769392.jpg
804;Мультиварка Atlanta ATH-1558;Антипригарное покрытие: тефлоновое, таймер автоотключения, Функции: автоприготовление, йогурт, выпечка, тушение, бобовые, рис/гречка, каша/суп, Программы: приготовление на пару, Кол-во программ: 8, Мощность (Вт): 700, Объем (л): 5, Тип: мультиварка;3111;…;164;http://magazilla.ru/jpg_zoom1/769351.jpg
805;Мультиварка Atlanta ATH-1556;Габариты (см): 30х30х27.5, Антипригарное покрытие: тефлоновое, таймер автоотключения, Функции: автоприготовление, йогурт, выпечка, жарка/фритюр, тушение, бобовые, рис/гречка, каша/суп, Программы: приготовление на пару, Кол-во программ: 8, Мощность (Вт): 700, Объем (л): 4, Тип: мультиварка;1867;…;164;http://magazilla.ru/jpg_zoom1/420207.jpg
806;Мультиварка Aresa AR-2008;Антипригарное покрытие: керамическое, таймер автоотключения, автоприготовление, Функции: термостат, пицца, холодец, выпечка, жарка/фритюр, тушение, макароны/паста, рис/гречка, каша/суп, Программы: приготовление на пару, Кол-во программ: 18, Мощность (Вт): 700, Объем (л): 5, Тип: мультиварка;2864;…;164;http://magazilla.ru/jpg_zoom1/1151300.jpg
807;Мультиварка Aresa AR-2002;Антипригарное покрытие: керамическое, таймер автоотключения, Функции: автоприготовление, пицца, холодец, йогурт, выпечка, жарка/фритюр, тушение, рис/гречка, каша/суп, Программы: приготовление на пару, Кол-во программ: 7, Мощность (Вт): 900, Объем (л): 5, Тип: мультиварка;2890;…;164;http://magazilla.ru/jpg_zoom1/937481.jpg
808;Пароварка / яйцеварка Tefal VC 1006;Вместительная пароварка;3696;…;165;http://magazilla.ru/jpg_zoom1/70684.jpg
809;Пароварка / яйцеварка Braun FS 5100;Вес (кг): 2.3, Материал паровых корзин: пластик, таймер автоотключения, Функции: быстрый нагрев, Мощность (Вт): 850, Чаша для риса, Кол-во корзин / яиц: 2, Общий объем (л): 2, Тип: пароварка ;7579;…;165;http://magazilla.ru/jpg_zoom1/800126.jpg
810;Пароварка / яйцеварка Braun FS 3000;Вес (кг): 2.4, Материал паровых корзин: пластик, Функции: таймер автоотключения, Мощность (Вт): 850, Чаша для риса, Кол-во корзин / яиц: 2, Тип: пароварка ;5051;…;165;http://magazilla.ru/jpg_zoom1/552067.jpg
811;Пароварка / яйцеварка Tefal VC 3008;Пароварка оснащена тремя паровыми корзинами;5742;…;165;http://magazilla.ru/jpg_zoom1/172248.jpg
812;Пароварка / яйцеварка Zauber X560;Вес (кг): 1.7, Материал паровых корзин: нержавеющая сталь, возможность долива воды, Функции: таймер автоотключения, Мощность (Вт): 700, Чаша для риса, Кол-во корзин / яиц: 3, Общий объем (л): 9, Тип: пароварка ;2808;…;165;http://magazilla.ru/jpg/230644.jpg
813;Кофеварка De'Longhi ESAM 4500;Модель примечательна съёмным бойлером для молока;37389;…;166;http://magazilla.ru/jpg_zoom1/69869.jpg
814;Кофеварка Polaris PCM 1518;Вес (кг): 7, Габариты (см): 20.5x32x30.3, Мощность (Вт): 1350, Давление (бар): 15, Объем резервуара (л): 1.3, Порций за 1 раз: 2, Приготовление капучино: автоматический, Используемый кофе: молотый, Тип: эспрессо (ручная) ;9229;…;166;http://magazilla.ru/jpg_zoom1/860171.jpg
815;Кофеварка De'Longhi ESAM 2800;Вес (кг): 10, Габариты (см): 29х36х38, Мощность (Вт): 1450, Давление (бар): 15, самоочистка после приготовления, подогрев чашек/кофейника, Емкость кофемолки (г): 200, Объем резервуара (л): 1.8, Порций за 1 раз: 2, Приготовление капучино: ручной, молотый, Используемый кофе: в зернах, Встроенная кофемолка ;22132;…;166;http://magazilla.ru/jpg_zoom1/169613.jpg
816;Кофеварка Sinbo SCM-2928;Вес (кг): 0.65, Мощность (Вт): 1000, Объем резервуара (л): 0.4, Используемый кофе: молотый, Тип: электротурка ;984;…;166;http://magazilla.ru/jpg_zoom1/386421.jpg
817;Кофеварка First FA-5450-1;Вес (кг): 0.49, Мощность (Вт): 800, Объем резервуара (л): 0.35, Используемый кофе: молотый, Тип: электротурка ;1045;…;166;http://magazilla.ru/jpg_zoom1/838212.jpg
818;Кофемолка Apach ACG2;Материал корпуса: пластик, Мощность (Вт): 340, Вместимость отсека для зерен (г): 1400, Система помола: жерновая;25929;…;167;http://magazilla.ru/jpg_zoom1/1033261.jpg
819;Кофемолка Ariete 3014;Материал корпуса: пластик, Отсек для шнура, Съемная чаша, Мощность (Вт): 170, Вместимость отсека для зерен (г): 45, Система помола: ножевая;3686;…;167;http://magazilla.ru/jpg_zoom1/597494.jpg
820;Кофемолка Ladomir 08;Материал корпуса: металл, Отсек для шнура, Мощность (Вт): 200, Вместимость отсека для зерен (г): 160, Система помола: ножевая;2176;…;167;http://magazilla.ru/jpg_zoom1/846697.jpg
821;Кофемолка Ladomir 06;Материал корпуса: пластик, Мощность (Вт): 150, Вместимость отсека для зерен (г): 50, Система помола: ножевая ;639;…;167;http://magazilla.ru/jpg_zoom1/820065.jpg
822;Кофемолка Ladomir 05;Материал корпуса: пластик, Мощность (Вт): 200, Вместимость отсека для зерен (г): 100, Система помола: ножевая ;1049;…;167;http://magazilla.ru/jpg_zoom1/598300.jpg
823;Тостер Bosch TAT 3A011;Материал корпуса: пластик, Поддон для крошек, высокий подъем, подогрев, Функции и возможности: автоцентрирование, Управление: ступенчатый переключатель, Степеней обжаривания: 6, Кол-во изделий: 2, Кол-во отделений: 2, Мощность (Вт): 980, Тип: тостер ;2005;…;168;http://magazilla.ru/jpg_zoom1/242835.jpg
824;Тостер Redmond RT-M403;Материал корпуса: сталь, Поддон для крошек, Дисплей, защита от перегрева, размораживание, подогрев, Функции и возможности: автоцентрирование, Управление: ступенчатый переключатель, Степеней обжаривания: 9, Кол-во изделий: 2, Кол-во отделений: 2, Мощность (Вт): 1000, Тип: тостер ;2959;…;168;http://magazilla.ru/jpg/173772.jpg
825;Тостер Redmond RMB-M611;Материал корпуса: пластик, Зажим-фиксатор, защита от перегрева, Функции и возможности: индикатор готовности, Кол-во изделий: 4, Кол-во отделений: 2, Мощность (Вт): 700, Тип: сэндвичница;2893;…;168;http://magazilla.ru/jpg_zoom1/1016241.jpg
826;Тостер Redmond RMB-M713/1;Материал корпуса: сталь, Зажим-фиксатор, защита от перегрева, Функции и возможности: индикатор готовности, Кол-во изделий: 4, Кол-во отделений: 1, Мощность (Вт): 1400, Тип: вафельница;2876;…;168;http://magazilla.ru/jpg_zoom1/1209608.jpg
827;Тостер GFGRIL GF-040;Материал корпуса: сталь, защита от перегрева, Функции и возможности: индикатор готовности, Управление: плавная регулировка, Кол-во изделий: 2, Кол-во отделений: 2, Мощность (Вт): 1000, Тип: сэндвичница ;4246;…;168;http://magazilla.ru/jpg_zoom1/803544.jpg
828;Сушилка фруктов JARKOFF JK-6R;Вес (кг): 6, Материал лотков: пластик, Защита от перегрева, Управление: механическое, Термостат, Потребляемая мощность (Вт): 600, Общий объем (л): 30, Кол-во лотков (шт): 8;2311;…;169;http://magazilla.ru/jpg/832637.jpg
829;Сушилка фруктов JARKOFF JK-5T;Вес (кг): 5.6, Габариты (мм): 390x390x424, Материал лотков: пластик, Защита от перегрева, Управление: механическое, Диапазон температур (°C): 30 - 70, Термостат, Потребляемая мощность (Вт): 600, Общий объем (л): 25, Кол-во лотков (шт): 5;2509;…;169;http://magazilla.ru/jpg_zoom1/865215.jpg
830;Сушилка фруктов Mystery MDH-321;Материал лотков: пластик, Потребляемая мощность (Вт): 250, Кол-во лотков (шт): 5 ;1736;…;169;http://magazilla.ru/jpg_zoom1/200405.jpg
831;Сушилка фруктов Supra DFS-523;Материал лотков: пластик, Защита от перегрева, Управление: механическое, Диапазон температур (°C): 40 - 75, Термостат, Потребляемая мощность (Вт): 250, Кол-во лотков (шт): 5 ;1152;…;169;http://magazilla.ru/jpg_zoom1/879365.jpg
832;Сушилка фруктов Oursson DH3501D;Материал лотков: пластик, Защита от перегрева, Таймер выключения, Управление: электронное, Диапазон температур (°C): 38 – 68, Термостат, Потребляемая мощность (Вт): 400, Кол-во лотков (шт): 8;4389;…;169;http://magazilla.ru/jpg_zoom1/1251193.jpg
833;Весы Karl Weis 10511;Материал платформы/чаши: стекло, автовыключение, измерение объема, тарокомпенсация, Цена деления (г): 1, Максимальная нагрузка (кг): 5, Механизм: электронный, Тип весов: кухонные;1182;…;170;http://magazilla.ru/jpg_zoom1/1118210.jpg
834;Весы Karl Weis 10501;Материал платформы/чаши: стекло, автовыключение, тарокомпенсация, Цена деления (г): 1, Максимальная нагрузка (кг): 5, Механизм: электронный, Тип весов: кухонные;1578;…;170;http://magazilla.ru/jpg_zoom1/1118206.jpg
835;Весы Salter 1046;Материал платформы/чаши: металл, автовыключение, последовательное взвешивание, тарокомпенсация, Цена деления (г): 1, Максимальная нагрузка (кг): 5, Механизм: электронный, Тип весов: кухонные;1648;…;170;http://magazilla.ru/jpg_zoom1/211123.jpg
836;Весы Salter 1037;Материал платформы/чаши: металл, автовыключение, последовательное взвешивание, тарокомпенсация, Цена деления (г): 1, Максимальная нагрузка (кг): 5, Механизм: электронный, Тип весов: кухонные ;1747;…;170;http://magazilla.ru/jpg/211118.jpg
837;Весы RST 08083;автовыключение, тарокомпенсация, Цена деления (г): 10, Максимальная нагрузка (кг): 40, Механизм: электронный, Тип весов: карманные;1551;…;170;http://magazilla.ru/jpg_zoom1/555205.jpg
838;Электрогриль Tefal GC712D;Вес (кг): 6.4, открытие на 180°, подстройка по высоте продукта, съемные пластины, термостат, Управление: электронное, Поверхность: рифленая, Материал поверхности: металлическая, Потребляемая мощность (Вт): 2000, Тип: контактный гриль ;13721;…;171;http://magazilla.ru/jpg_zoom1/907854.jpg
839;Электрогриль Tefal GC3060;открытие на 180°, подстройка по высоте продукта, съемные пластины, термостат, Управление: механическое, Поверхность: рифленая, Материал поверхности: металлическая, Потребляемая мощность (Вт): 2000, Тип: контактный гриль ;6732;…;171;http://magazilla.ru/jpg_zoom1/362427.jpg
840;Электрогриль Tefal GC722D;Вес (кг): 5.2, подстройка по высоте продукта, съемные пластины, автоотключение, термостат, Управление: электронное, Поверхность: рифленая, Материал поверхности: металлическая, Потребляемая мощность (Вт): 2000, Тип: контактный гриль ;14804;…;171;http://magazilla.ru/jpg_zoom1/907832.jpg
841;Электрогриль Tefal GC241D;Вес (кг): 0.82, подстройка по высоте продукта, термостат, Управление: механическое, Поверхность: рифленая, Материал поверхности: металлическая, Потребляемая мощность (Вт): 2000, Тип: контактный гриль ;3285;…;171;http://magazilla.ru/jpg_zoom1/1090859.jpg
842;Электрогриль Tefal GC702D;подстройка по высоте продукта, автоотключение, термостат, Управление: электронное, Поверхность: рифленая, Материал поверхности: металлическая, Потребляемая мощность (Вт): 2000, Тип: контактный гриль ;14275;…;171;http://magazilla.ru/jpg_zoom1/701980.jpg
843;Аэрогриль Hotter HX-1087 Tiger;автоотключение при открытии крышки, самоочистка, автоприготовление, таймер выключения, Функции: термостат, Управление: электронное, Увеличительное кольцо, Объем чаши (л): 10, Потребляемая мощность (Вт): 1300, Нагревательный элемент: галогенный ;11165;…;172;http://magazilla.ru/jpg_zoom1/210643.jpg
844;Аэрогриль Lex Mercury;автоотключение при открытии крышки, таймер выключения, Функции: термостат, Управление: механическое, Объем чаши (л): 3, Потребляемая мощность (Вт): 1800, Нагревательный элемент: галогенный;7181;…;172;http://magazilla.ru/jpg_zoom1/1227311.jpg
845;Аэрогриль Blaze AG 202;автоотключение при открытии крышки, таймер выключения, Функции: термостат, Управление: механическое, Объем чаши (л): 9, Потребляемая мощность (Вт): 1000, Нагревательный элемент: галогенный;5050;…;172;http://magazilla.ru/jpg/246014.jpg
846;Аэрогриль Delimano 3D;автоотключение при открытии крышки, самоочистка, автоприготовление, таймер отсрочки старта, таймер выключения, Функции: термостат, Управление: электронное, Объем чаши (л): 10, Потребляемая мощность (Вт): 1400, Нагревательный элемент: галогенный;19030;…;172;http://magazilla.ru/jpg_zoom1/996810.jpg
847;Аэрогриль Smile AG 1910;автоотключение при открытии крышки, самоочистка, таймер выключения, Функции: термостат, Управление: механическое, Объем чаши (л): 9, Потребляемая мощность (Вт): 1000, Нагревательный элемент: галогенный ;2904;…;172;http://magazilla.ru/jpg_zoom1/214180.jpg
848;Фритюрница GFGRIL GFF-03;Вес (кг): 1.6, Габариты (мм): 250х220х210, Материал корпуса: металл, Программы: Потребляемая мощность (Вт): 900, антипригарное покрытие, индикатор нагрева, фильтр против запаха, смотровое окно, съемная чаша, Объем чаши (л): 1.5, Вместимость корзины (кг): 0.5, Тип: фритюрница ;2196;…;173;http://magazilla.ru/jpg_zoom1/1087741.jpg
849;Фритюрница GFGRIL GFF-05;Материал корпуса: пластик, Программы: Потребляемая мощность (Вт): 1800, антипригарное покрытие, индикатор нагрева, фильтр против запаха, смотровое окно, съемная чаша, Объем чаши (л): 2.5, Тип: фритюрница ;3289;…;173;http://magazilla.ru/jpg_zoom1/931236.jpg
850;Фритюрница GFGRIL GFA-3500;Вес (кг): 5.5, Материал корпуса: пластик, Потребляемая мощность (Вт): 1500, кекс, рыба, креветки, мясо, курица, Программы: фри, индикатор нагрева, фильтр против запаха, съемная чаша, Объем чаши (л): 3.2, Таймер: электронный, Тип: мультипечь;7687;…;173;http://magazilla.ru/jpg_zoom1/1008699.jpg
