id;name;description;price;catalog_url;category_id;picture_url
696;Встраиваемый холодильник Whirlpool ART 868;Габариты (см): 177х54.5х54, Уровень шума (дБ): 37, Дисплей, No Frost: Морозильная камера, зона свежести, перевешивание дверей, Функции: авторазморозка, Время сохранения холода (ч): 15, Тем-ра морозилки: до -24°C, Общий объем (л): 271, Объем морозилки (л): 72, Объем холодильника (л): 199, Морозилка: снизу;42900;…;142;http://magazilla.ru/jpg_zoom1/262811.jpg
697;Встраиваемый холодильник Whirlpool ARG 18082;Разм. встраивания (мм): 1776x560x555, Габариты (см): 177x54x55, Уровень шума (дБ): 34, Дисплей, защита от детей, режим отпуска, перевешивание дверей, Функции: авторазморозка, Общий объем (л): 318, Объем холодильника (л): 318, Морозилка: отсутствует, Кол-во камер: 1;51206;…;142;http://magazilla.ru/jpg_zoom1/1070063.jpg
698;Встраиваемая морозильная камера Bosch GUD 15A50;Разм. для встраивания (мм): 820х560х550, Габариты (см): 82х60х55, Класс энергопотребления: A+, Быстрая заморозка, Индикатор закрытия дверцы, Мощность замораживания (кг/сутки): 12, Сохранение холода (ч): 24, Мин. температура: до -18°C, Управление: кнопочные переключатели, Кол-во отделений: 3, Общий объем (л): 100 ;30680;…;143;http://magazilla.ru/jpg_zoom1/147349.jpg
699;Встраиваемая морозильная камера Beko BU 1200 HCA;Разм. для встраивания (мм): 820х560х550, Габариты (см): 85х54х55, Класс энергопотребления: A, Быстрая заморозка, Мощность замораживания (кг/сутки): 10, Сохранение холода (ч): 19, Мин. температура: до -18°C, Управление: кнопочные переключатели, Кол-во отделений: 3, Общий объем (л): 87, Тип: морозильный шкаф ;17622;…;143;http://magazilla.ru/jpg/141922.jpg
700;Встраиваемая морозильная камера Bosch GIN 81AE20;Габариты (см): 178x56x55, Уровень шума (дБ): 36, Класс энергопотребления: A+, Быстрая заморозка, No Frost, Мин. температура: до -24°C, Управление: кнопочные переключатели, Кол-во отделений: 7, Общий объем (л): 211, Тип: морозильный шкаф;60940;…;143;http://magazilla.ru/jpg_zoom1/960023.jpg
701;Встраиваемая морозильная камера Liebherr IGN 3556;Разм. для встраивания (мм): 1870x560x550, Габариты (см): 178x56x55, Класс энергопотребления: A++, Быстрая заморозка, Индикатор закрытия дверцы, No Frost, Мощность замораживания (кг/сутки): 18, Сохранение холода (ч): 34, Мин. температура: до -24°C, Управление: кнопочные переключатели, Кол-во отделений: 8;75889;…;143;http://magazilla.ru/jpg_zoom1/407914.jpg
702;Встраиваемая морозильная камера Bosch GIV 11AF20;Разм. для встраивания (мм): 710x560x550, Габариты (см): 71x56x55, Уровень шума (дБ): 36, Класс энергопотребления: A++, Быстрая заморозка, Индикатор закрытия дверцы, Мощность замораживания (кг/сутки): 8, Сохранение холода (ч): 21, Мин. температура: до -24°C, Управление: кнопочные переключатели, Кол-во отделений: 3;31350;…;143;http://magazilla.ru/jpg_zoom1/1121552.jpg
703;Встраиваемый винный шкаф Dunavox DX-17.58DBK;Габариты (см): 87x30x56, Уровень шума (дБ): 39, Класс энергопотребления: C, Дисплей, Внутреннее освещение, Функции: Ф-ция подогрева, Материал полок: деревянные, Дверь: стеклянная (тонированная), Управление: сенсорное, Макс. температура (°С): 22, Мин. температура (°С): 5, Объем (л): 58, Температурных зон: 2 ;74679;…;144;http://magazilla.ru/jpg_zoom1/467408.jpg
704;Встраиваемый винный шкаф Liebherr WTUes 1653;Разм. для встраивания (мм): 870х600х560, Габариты (см): 82х60х56, Уровень шума (дБ): 43, Класс энергопотребления: A, Дисплей, Внутреннее освещение, Замок, Функции: Антивибрационная система, Материал полок: деревянные, Дверь: стеклянная (тонированная), Управление: кнопочные переключатели, Макс. температура (°С): 20;46299;…;144;http://magazilla.ru/jpg_zoom1/132937.jpg
705;Встраиваемый винный шкаф Dunavox DX-7.20BK;Разм. для встраивания (мм): 822x155x550, Габариты (см): 83x15x53, Уровень шума (дБ): 43, Класс энергопотребления: B, Дисплей, Функции: Внутреннее освещение, Материал полок: металлические, Дверь: стеклянная (тонированная), Управление: сенсорное, Макс. температура (°С): 22, Мин. температура (°С): 5, Объем (л): 20;41690;…;144;http://magazilla.ru/jpg_zoom1/1002572.jpg
706;Встраиваемый винный шкаф Liebherr WTI 2050;Разм. для встраивания (мм): 1236х570х550, Габариты (см): 122х56х55, Класс энергопотребления: A, Дисплей, Внутреннее освещение, Замок, Вертикальное хранение бутылок, Функции: Антивибрационная система, Материал полок: деревянные, Дверь: глухая, Управление: кнопочные переключатели, Макс. температура (°С): 20;105631;…;144;http://magazilla.ru/jpg_zoom1/132953.jpg
707;Встраиваемый винный шкаф Liebherr WKEes 553;Разм. для встраивания (мм): 450x560x550, Габариты (см): 46x59x52, Уровень шума (дБ): 32, Класс энергопотребления: A+, Дисплей, Внутреннее освещение, Замок, Функции: Антивибрационная система, Материал полок: деревянные, Дверь: стеклянная (тонированная), Управление: кнопочные переключатели, Макс. температура (°С): 20;67760;…;144;http://magazilla.ru/jpg_zoom1/118669.jpg
708;Встраиваемая микроволновая печь Bosch BFL 634GB1;Габариты (см): 38x59x32, Открытие дверцы: боковое, авторазмораживание, автоприготовление, размораживание, Внутреннее покрытие: нержавеющая сталь, Управление: сенсорное, Мощность (Вт): 900, Объем (л): 21 ;31945;…;145;http://magazilla.ru/jpg_zoom1/582736.jpg
709;Встраиваемая микроволновая печь Samsung FW77SR;Габариты (см): 31х49х35, Открытие дверцы: боковое, защита от детей, авторазмораживание, автоприготовление, размораживание, приготовление на пару, Внутреннее покрытие: керамика, Управление: кнопочные переключатели, Мощность (Вт): 800, Объем (л): 20 ;12078;…;145;http://magazilla.ru/jpg_zoom1/234706.jpg
710;Встраиваемая микроволновая печь Bosch HMT 75M654;Габариты (см): 38x59x32, Открытие дверцы: боковое, авторазмораживание, автоприготовление, размораживание, Внутреннее покрытие: нержавеющая сталь, Диаметр поддона (мм): 255, Управление: тактовое/кнопочное, Мощность (Вт): 800, Объем (л): 20;17424;…;145;http://magazilla.ru/jpg_zoom1/784707.jpg
711;Встраиваемая микроволновая печь Samsung FW87SSTR;Габариты (см): 28x49x34, Открытие дверцы: боковое, защита от детей, авторазмораживание, автоприготовление, размораживание, Внутреннее покрытие: керамика, Диаметр поддона (мм): 288, Управление: кнопочные переключатели, Мощность (Вт): 800, Объем (л): 23 ;11495;…;145;http://magazilla.ru/jpg_zoom1/650663.jpg
712;Встраиваемая микроволновая печь Whirlpool AMW 730;Габариты (см): 39x60x47, Открытие дверцы: откидная, авторазмораживание, автоприготовление, размораживание, конвекция, гриль, Диаметр поддона (мм): 325, Управление: сенсорное, Мощность (Вт): 800, Объем (л): 31 ;30831;…;145;http://magazilla.ru/jpg_zoom1/588002.jpg
713;Кухонная мойка GranFest Quadro GF-Q560;Размеры основной чаши (мм): 510х360х200, Размеры рабочей поверхности (мм): 565x510, Мин. ширина шкафа (мм): 600, Дополнительно: Перелив, Основных чаш: 1, Форма: прямоугольная, Материал корпуса: гранит, Тип монтажа: врезная накладная ;5445;…;146;http://magazilla.ru/jpg_zoom1/238517.jpg
714;Кухонная мойка Franke Polar PXN 651-78;Размеры емкости разморозки (мм): 172x310x105, Размеры основной чаши (мм): 350x410x175, Размеры рабочей поверхности (мм): 780x490, Мин. ширина шкафа (мм): 600, Дополнительно: Перелив, Сушка посуды (крыло), Емкость для размораживания, Основных чаш: 1, Форма: прямоугольная, Материал корпуса: нержавеющая сталь ;2902;…;146;http://magazilla.ru/jpg_zoom1/294920.jpg
715;Кухонная мойка Franke Polar PXN 611-60;Размеры основной чаши (мм): 350x410x175, Размеры рабочей поверхности (мм): 615x490, Мин. ширина шкафа (мм): 450, Дополнительно: Перелив, Сушка посуды (крыло), Основных чаш: 1, Форма: прямоугольная, Материал корпуса: нержавеющая сталь, Тип монтажа: врезная накладная;2224;…;146;http://magazilla.ru/jpg_zoom1/294901.jpg
716;Кухонная мойка Blanco Legra 6S Compact;Размеры емкости разморозки (мм): 170x265x120, Размеры основной чаши (мм): 330x430x190, Размеры рабочей поверхности (мм): 780х500, Дополнительно: Мин. ширина шкафа (мм): 600, Сушка посуды (крыло), Емкость для размораживания, Основных чаш: 1, Форма: прямоугольная, Материал корпуса: гранит, Тип монтажа: врезная накладная;11550;…;146;http://magazilla.ru/jpg_zoom1/735208.jpg
717;Кухонная мойка Oulin OL-357;Размеры основной чаши (мм): 375x375x200, Размеры рабочей поверхности (мм): 435x435, Мин. ширина шкафа (мм): 500, Дополнительно: Перелив, Основных чаш: 1, Форма: круглая, Материал корпуса: нержавеющая сталь, Тип монтажа: врезная накладная ;5328;…;146;http://magazilla.ru/jpg_zoom1/596416.jpg
718;Встраиваемая пароварка Bosch CDG 634BS1;Габариты (см): 46x60x57, Класс энергопотребления: A, Открытие дверцы: сверху вниз, Программ приготовления (шт): 20, Защита от детей, Автоприготовление, Размораживание, Таймер, Автоотключение, Функции: Удаление накипи, Внутреннее покрытие: нержавеющая сталь, Управление: поворотные переключатели с сенсорами ;52855;…;147;http://magazilla.ru/jpg_zoom1/585509.jpg
719;Встраиваемая пароварка Gorenje BOC 6322;Габариты (см): 46х60х57, Класс энергопотребления: A, Открытие дверцы: сверху вниз, Термощуп, Защита от детей, Автоприготовление, Размораживание, Таймер, Автоотключение, Функции: Конвекция, Внутреннее покрытие: нержавеющая сталь, Управление: сенсорное, Объем (л): 27;28462;…;147;http://magazilla.ru/jpg_zoom1/127482.jpg
720;Встраиваемая пароварка Siemens CD 634GBS1;Габариты (см): 46x60x57, Класс энергопотребления: A, Открытие дверцы: сверху вниз, Программ приготовления (шт): 20, Защита от детей, Автоприготовление, Размораживание, Таймер, Автоотключение, Функции: Удаление накипи, Внутреннее покрытие: нержавеющая сталь, Управление: поворотные переключатели с кнопками;59345;…;147;http://magazilla.ru/jpg_zoom1/586253.jpg
721;Встраиваемая пароварка Zigmund&Shtain EN 100.511;Класс энергопотребления: A, Открытие дверцы: сверху вниз, Защита от детей, Автоприготовление, Размораживание, Таймер, Автоотключение, Функции: Конвекция, Внутреннее покрытие: нержавеющая сталь, Управление: сенсорное, Объем (л): 26;33000;…;147;http://magazilla.ru/jpg_zoom1/229010.jpg
722;Встраиваемая пароварка Siemens HB 36D575;Габариты (см): 45х59х55, Класс энергопотребления: A, Открытие дверцы: сверху вниз, Программ приготовления (шт): 70, Защита от детей, Автоприготовление, Размораживание, Таймер, Автоотключение, Функции: Конвекция, Внутреннее покрытие: нержавеющая сталь, Управление: поворотные переключатели с кнопками ;48074;…;147;http://magazilla.ru/jpg_zoom1/192546.jpg
723;Встраиваемая кофеварка Bosch CTL 636ES1;Габариты (см): 59x46x38, Мощность (Вт): 1600, Давление (бар): 19, защита от детей, самоочистка после приготовления, Емкость кофемолки (г): 500, Объем резервуара (л): 2.4, Порций за 1 раз: 2, Приготовление капучино: автоматический, молотый, Используемый кофе: в зернах, Встроенная кофемолка, Тип: эспрессо (автоматическая) ;86350;…;148;http://magazilla.ru/jpg_zoom1/583101.jpg
724;Встраиваемая кофеварка Siemens CT 636LEW1;Габариты (см): 59x46x38, Мощность (Вт): 1600, Давление (бар): 19, защита от детей, самоочистка после приготовления, Емкость кофемолки (г): 500, Объем резервуара (л): 2.4, Порций за 1 раз: 2, Приготовление капучино: автоматический, молотый, Используемый кофе: в зернах, Встроенная кофемолка, Тип: эспрессо (автоматическая);90200;…;148;http://magazilla.ru/jpg_zoom1/583093.jpg
725;Встраиваемая кофеварка Neff C77V60N2;Габариты (см): 59х45х52, Мощность (Вт): 1700, Давление (бар): 19, таймер приготовления, самоочистка после приготовления, Емкость кофемолки (г): 1000, Объем резервуара (л): 2.5, Порций за 1 раз: 2, Приготовление капучино: автоматический, молотый, Используемый кофе: в зернах, Встроенная кофемолка, Тип: эспрессо (автоматическая) ;72438;…;148;http://magazilla.ru/jpg_zoom1/146011.jpg
726;Встраиваемая кофеварка Whirlpool ACE 010;Габариты (см): 60х38х29, Мощность (Вт): 1000, Давление (бар): 15, Объем резервуара (л): 1.8, Порций за 1 раз: 2, Приготовление капучино: ручной, Используемый кофе: молотый, Тип: эспрессо (автоматическая);31900;…;148;http://magazilla.ru/jpg_zoom1/150740.jpg
727;Встраиваемая кофеварка Neff C15KS61N0;Габариты (см): 60x46x38, Мощность (Вт): 1600, Давление (бар): 19, таймер приготовления, самоочистка после приготовления, Емкость кофемолки (г): 500, Объем резервуара (л): 2.4, Порций за 1 раз: 2, Приготовление капучино: автоматический, молотый, Используемый кофе: в зернах, Встроенная кофемолка, Тип: эспрессо (автоматическая);143000;…;148;http://magazilla.ru/jpg_zoom1/536700.jpg
728;Измельчитель отходов In-Sink-Erator Evolution 200;Вес (кг): 11.6, Габариты (мм): 344x234, Потребляемая мощность (Вт): 380, Авто-реверс, Ступеней измельчения: 3, Объем камеры (мл): 1180, Количество оборотов (об/мин): 1425, Мощность (л.с.): 0.75 ;24190;…;149;http://magazilla.ru/jpg_zoom1/363361.jpg
729;Измельчитель отходов In-Sink-Erator Evolution 100;Вес (кг): 8.8, Габариты (мм): 312x205, Потребляемая мощность (Вт): 380, Авто-реверс, Ступеней измельчения: 2, Объем камеры (мл): 1005, Количество оборотов (об/мин): 1425, Мощность (л.с.): 0.7;20780;…;149;http://magazilla.ru/jpg_zoom1/363350.jpg
730;Измельчитель отходов Zorg ZR-75 D;Вес (кг): 6.9, Габариты (мм): 320x185, Потребляемая мощность (Вт): 750, Ступеней измельчения: 1, Объем камеры (мл): 1320, Количество оборотов (об/мин): 3300, Мощность (л.с.): 1;11319;…;149;http://magazilla.ru/jpg/367734.jpg
731;Измельчитель отходов In-Sink-Erator Model 56;Вес (кг): 7.2, Габариты (мм): 318x173, Потребляемая мощность (Вт): 380, Ступеней измельчения: 1, Объем камеры (мл): 980, Количество оборотов (об/мин): 1425, Мощность (л.с.): 0.55;9900;…;149;http://magazilla.ru/jpg_zoom1/697360.jpg
732;Измельчитель отходов BONE CRUSHER BC 610;Вес (кг): 4.1, Габариты (мм): 355x121, Потребляемая мощность (Вт): 475, Ступеней измельчения: 1, Объем камеры (мл): 600, Количество оборотов (об/мин): 2600, Мощность (л.с.): 0.5;13142;…;149;http://magazilla.ru/jpg/1132677.jpg
733;Стиральная машина Bosch WLG 20060;Стиральная машинка с фронтальной загрузкой;15214;…;150;http://magazilla.ru/jpg_zoom1/238759.jpg
734;Стиральная машина Samsung WW65K42E00S;Габариты (см): 85x60x45, Люк для дозагрузки белья, Дисплей, Защита от детей, Класс энергопотребления: A, Класс отжима: B, Класс стирки: A, Контроль дисбаланса, Контроль пенообразования, Защита от протечек, Воздушно-пузырьковая стирка, Стирка паром, Таймер отсрочки старта, Быстрая стирка, Инверторный двигатель;26609;…;150;http://magazilla.ru/jpg_zoom1/944720.jpg
735;Стиральная машина LG F10B8ND;Функциональные возможности данной стиралки вполне соответствуют модели средней ценовой категории. Она оборудована барабаном с максимальной загрузкой 6 кг и регулируемой в 4 различных режимах скоростью отжима (максимальная составляет 1000 об/мин). Панель управления оборудована дисплеем. Набор программ преимущественно классический;19349;…;150;http://magazilla.ru/jpg_zoom1/278540.jpg
736;Стиральная машина LG F1096SD3;Модель оборудована скромным по современным меркам барабаном;21549;…;150;http://magazilla.ru/jpg_zoom1/288373.jpg
737;Стиральная машина Bosch WLG 20160;За один цикл модель способна постирать до 5 кг белья;16974;…;150;http://magazilla.ru/jpg_zoom1/229172.jpg
738;Холодильник Gorenje NRK 621 CLI;Габариты (см): 200x60x64, Уровень шума (дБ): 42, No Frost: морозильная/холодильная камеры, динамическое охлаждение, быстрая заморозка, зона свежести, перевешивание дверей, индикатор закрытия дверцы, Функции: авторазморозка, Время сохранения холода (ч): 18, Общий объем (л): 339, Объем морозилки (л): 85 ;54110;…;151;http://magazilla.ru/jpg_zoom1/693935.jpg
739;Холодильник Samsung RB37K63412A;Габариты (см): 201x60x69, Уровень шума (дБ): 36, Скрытые дверные ручки, Дисплей, No Frost: морозильная/холодильная камеры, инверторный компрессор, динамическое охлаждение, режим отпуска, быстрое охлаждение, быстрая заморозка, зона свежести, перевешивание дверей, индикатор закрытия дверцы, Функции: авторазморозка ;93489;…;151;http://magazilla.ru/jpg_zoom1/939772.jpg
740;Холодильник Indesit DF 5180;Габариты (см): 185x60x64, Уровень шума (дБ): 40, Скрытые дверные ручки, No Frost: морозильная/холодильная камеры, динамическое охлаждение, перевешивание дверей, индикатор закрытия дверцы, Функции: авторазморозка, Время сохранения холода (ч): 13, Общий объем (л): 302, Объем морозилки (л): 75, Объем холодильника (л): 227 ;24717;…;151;http://magazilla.ru/jpg_zoom1/633475.jpg
